{
  "spec_version": "context-layer/0.3-draft",
  "type": "context_pass",
  "id": "urn:cl:pass:pass_4401",
  "created_at": "2026-08-28T18:05:00Z",
  "issuer": {
    "id": "urn:cl:pass-issuer:local"
  },
  "subject_ref": "vault://subjects/primary",
  "principal": "urn:app:notes",
  "client_instance": "urn:device:local-workstation",
  "pairing_ref": "urn:cl:pairing:pair_4401",
  "categories": [
    "preference",
    "fact"
  ],
  "allowed_purpose_codes": [
    "retrieve.context",
    "draft.response"
  ],
  "expires_at": "2026-09-04T18:05:00Z",
  "revocable": true,
  "status": "active"
}
